{
  "artifact_id": "PMO-01.04",
  "metadata": {
    "project_name": "Digital Transformation Core",
    "project_code": "PRJ-2026-01-04",
    "date_prepared": "2026-10-12",
    "project_manager": "Sarah Jenkins",
    "prepared_by": "PMO Governance Directorate",
    "version": "1.0",
    "status": "approved"
  },
  "analysis_context": {
    "analysis_objective_and_scope": "Substantive completed details for Analysis Objective And Scope.",
    "current_state_summary": "Substantive completed details for Current State Summary.",
    "desired_target_state": "Substantive completed details for Desired Target State."
  },
  "gap_evaluation_matrix": {
    "functional_and_process_gaps": "Substantive completed details for Functional And Process Gaps.",
    "technical_and_systems_gaps": "Substantive completed details for Technical And Systems Gaps.",
    "people_and_competency_gaps": "Substantive completed details for People And Competency Gaps.",
    "risk_and_business_impact": "Substantive completed details for Risk And Business Impact."
  },
  "remediation_strategy": {
    "closure_initiative_description": "Substantive completed details for Closure Initiative Description.",
    "priority_and_execution_feasibility": "Substantive completed details for Priority And Execution Feasibility.",
    "assigned_owner_and_target_date": "Substantive completed details for Assigned Owner And Target Date."
  }
}